{
  "$schema": "http://json-schema.org/draft-07/schema#",
  "title": "Project Build Configuration",
  "type": "object",
  "additionalProperties": false,
  "properties": {
    "$schema": {
      "type": "string"
    },
    "RootPath": {
      "type": "string"
    },
    "ExpectedVersion": {
      "type": [
        "string",
        "null"
      ]
    },
    "ExpectedVersionMap": {
      "type": [
        "object",
        "null"
      ],
      "additionalProperties": {
        "type": "string"
      }
    },
    "VersionTracks": {
      "type": [
        "object",
        "null"
      ],
      "additionalProperties": {
        "$ref": "#/definitions/versionTrack"
      }
    },
    "VersionBindings": {
      "type": [
        "array",
        "null"
      ],
      "description": "Repository files whose embedded versions follow a resolved project version. Every binding must match exactly once.",
      "items": {
        "$ref": "#/definitions/versionBinding"
      }
    },
    "ExpectedVersionMapAsInclude": {
      "type": "boolean"
    },
    "ExpectedVersionMapUseWildcards": {
      "type": "boolean"
    },
    "AlignPackageVersions": {
      "type": "boolean",
      "description": "When true, projects sharing the same X-pattern are stepped from the highest current package version found across that group and receive one aligned next version."
    },
    "IncludeProjects": {
      "type": "array",
      "items": {
        "type": "string"
      }
    },
    "ExcludeProjects": {
      "type": "array",
      "items": {
        "type": "string"
      }
    },
    "ExcludeDirectories": {
      "type": "array",
      "items": {
        "type": "string"
      }
    },
    "NugetSource": {
      "type": "array",
      "items": {
        "type": "string"
      }
    },
    "IncludePrerelease": {
      "type": "boolean"
    },
    "Configuration": {
      "type": "string",
      "enum": [
        "Release",
        "Debug"
      ]
    },
    "OutputPath": {
      "type": [
        "string",
        "null"
      ]
    },
    "ReleaseZipOutputPath": {
      "type": [
        "string",
        "null"
      ]
    },
    "StagingPath": {
      "type": [
        "string",
        "null"
      ]
    },
    "CleanStaging": {
      "type": "boolean",
      "description": "Deletes the configured staging directory before the run. This does not clean project bin/obj outputs; package compilation freshness is enforced by the release rebuild."
    },
    "PlanOnly": {
      "type": "boolean"
    },
    "PlanOutputPath": {
      "type": [
        "string",
        "null"
      ]
    },
    "UpdateVersions": {
      "type": "boolean"
    },
    "Build": {
      "type": "boolean"
    },
    "PackStrategy": {
      "type": "string",
      "enum": [
        "PerProject",
        "MSBuild",
        "Batch"
      ],
      "description": "Controls how selected projects are packed. PerProject runs a non-incremental build followed by dotnet pack --no-build for each project. MSBuild/Batch requires OutputPath or StagingPath, generates a temporary MSBuild traversal project, and rebuilds then packs selected projects in one invocation; when no package output path is available it falls back to PerProject. Both strategies verify primary managed assemblies under lib/<tfm>, runtimes/<rid>/lib/<tfm>, and tools/<tfm>/any against exact fresh build target directories before signing or publishing. Native runtime assets and metadata-only packages are not assembly-hash targets. The batch target runs Restore;Rebuild;Pack, requires private feed credentials to be available to dotnet/MSBuild restore, stops on the first project failure, and treats the whole failed batch as failed, so already-produced packages from that batch are not signed or published. Projects without a resolved version are reported as failed skipped projects."
    },
    "IncludeSymbols": {
      "type": "boolean",
      "description": "When true, creates portable .snupkg symbol packages and includes them in publish and staged release outputs."
    },
    "PublishNuget": {
      "type": "boolean"
    },
    "PublishGitHub": {
      "type": "boolean"
    },
    "CreateReleaseZip": {
      "type": "boolean"
    },
    "UseGitHubPackages": {
      "type": "boolean",
      "description": "When true, resolves the NuGet version lookup and publish feed to GitHub Packages for GitHubPackagesOwner, or GitHubUsername when the owner is omitted."
    },
    "GitHubPackagesOwner": {
      "type": [
        "string",
        "null"
      ],
      "description": "GitHub user or organization that owns the GitHub Packages NuGet feed. Defaults to GitHubUsername when UseGitHubPackages is true."
    },
    "CertificateThumbprint": {
      "type": [
        "string",
        "null"
      ]
    },
    "CertificateStore": {
      "type": "string",
      "enum": [
        "CurrentUser",
        "LocalMachine"
      ]
    },
    "TimeStampServer": {
      "type": [
        "string",
        "null"
      ]
    },
    "SignAssemblies": {
      "type": "boolean",
      "description": "When true and CertificateThumbprint is configured, signs build outputs before NuGet packages and release ZIPs are created. Defaults to true when CertificateThumbprint is set."
    },
    "SignDependencyAssemblies": {
      "type": "boolean",
      "description": "When true, assembly signing also signs copied dependency assemblies from build output folders. Defaults to false so only the current project's assemblies are signed."
    },
    "SignPackages": {
      "type": "boolean",
      "description": "When true and CertificateThumbprint is configured, signs generated NuGet packages. Defaults to true when CertificateThumbprint is set."
    },
    "OverwriteSignedAssemblies": {
      "type": "boolean",
      "description": "When true, explicitly replaces existing Authenticode assembly signatures. Defaults to false."
    },
    "OverwriteSignedPackages": {
      "type": "boolean",
      "description": "When true, explicitly replaces existing NuGet package signatures. Defaults to false."
    },
    "PublishSource": {
      "type": [
        "string",
        "null"
      ]
    },
    "PublishApiKey": {
      "type": [
        "string",
        "null"
      ]
    },
    "PublishApiKeyFilePath": {
      "type": [
        "string",
        "null"
      ]
    },
    "PublishApiKeyEnvName": {
      "type": [
        "string",
        "null"
      ]
    },
    "SkipDuplicate": {
      "type": "boolean"
    },
    "PublishFailFast": {
      "type": "boolean"
    },
    "NugetCredentialUserName": {
      "type": [
        "string",
        "null"
      ]
    },
    "NugetCredentialSecret": {
      "type": [
        "string",
        "null"
      ]
    },
    "NugetCredentialSecretFilePath": {
      "type": [
        "string",
        "null"
      ]
    },
    "NugetCredentialSecretEnvName": {
      "type": [
        "string",
        "null"
      ]
    },
    "GitHubAccessToken": {
      "type": [
        "string",
        "null"
      ]
    },
    "GitHubAccessTokenFilePath": {
      "type": [
        "string",
        "null"
      ]
    },
    "GitHubAccessTokenEnvName": {
      "type": [
        "string",
        "null"
      ]
    },
    "GitHubUsername": {
      "type": [
        "string",
        "null"
      ]
    },
    "GitHubRepositoryName": {
      "type": [
        "string",
        "null"
      ]
    },
    "GitHubReleaseMode": {
      "type": "string",
      "enum": [
        "Single",
        "PerProject"
      ]
    },
    "GitHubPrimaryProject": {
      "type": [
        "string",
        "null"
      ]
    },
    "GitHubTagName": {
      "type": [
        "string",
        "null"
      ]
    },
    "GitHubTagTemplate": {
      "type": [
        "string",
        "null"
      ],
      "description": "Template for computed GitHub tag names. Supported tokens: {Project}, {Version}, {PrimaryProject}, {PrimaryVersion}, {Repo}, {Repository}, {Date}, {UtcDate}, {DateTime}, {UtcDateTime}, {Timestamp}, {UtcTimestamp}."
    },
    "GitHubTagConflictPolicy": {
      "type": [
        "string",
        "null"
      ],
      "enum": [
        "Reuse",
        "Fail",
        "AppendUtcTimestamp",
        null
      ]
    },
    "GitHubIsPreRelease": {
      "type": "boolean"
    },
    "GitHubIncludeProjectNameInTag": {
      "type": "boolean"
    },
    "GitHubGenerateReleaseNotes": {
      "type": "boolean"
    },
    "GitHubReleaseName": {
      "type": [
        "string",
        "null"
      ],
      "description": "Template for GitHub release display name. Supports the same tokens as GitHubTagTemplate."
    }
  },
  "definitions": {
    "versionBinding": {
      "type": "object",
      "additionalProperties": false,
      "required": [
        "Path",
        "Project",
        "Pattern"
      ],
      "properties": {
        "Path": {
          "type": "string",
          "minLength": 1,
          "description": "Repository-relative path of the file to update."
        },
        "Project": {
          "type": "string",
          "minLength": 1,
          "description": "Project name whose resolved release version is used."
        },
        "Pattern": {
          "type": "string",
          "minLength": 1,
          "description": "Regular expression that must match exactly once in the target file."
        },
        "Replacement": {
          "type": "string",
          "minLength": 1,
          "default": "{Version}",
          "description": "Replacement text containing the {Version} token."
        },
        "SyncAgentPluginCompatibility": {
          "type": "boolean",
          "default": false,
          "description": "For canonical agent-plugin plugin.json bindings, regenerate existing Codex and Claude compatibility files in the release transaction."
        }
      }
    },
    "versionTrack": {
      "type": "object",
      "additionalProperties": false,
      "properties": {
        "ExpectedVersion": {
          "type": [
            "string",
            "null"
          ]
        },
        "AnchorProject": {
          "type": [
            "string",
            "null"
          ]
        },
        "AnchorPackageId": {
          "type": [
            "string",
            "null"
          ]
        },
        "Projects": {
          "type": "array",
          "items": {
            "type": "string"
          }
        },
        "NugetSource": {
          "type": "array",
          "items": {
            "type": "string"
          }
        },
        "IncludePrerelease": {
          "type": "boolean"
        }
      }
    }
  }
}
