{
  "$schema": "https://raw.githubusercontent.com/EvotecIT/PSPublishModule/main/Schemas/project.build.schema.json",
  "RootPath": "..",
  "VersionTracks": {
    "PowerForge": {
      "ExpectedVersion": "1.0.X",
      "AnchorProject": "PowerForge",
      "Projects": [
        "PowerForge.PowerShell",
        "PowerForge.Cli",
        "PowerForge.Blazor",
        "PowerForge.Web",
        "PowerForge.Web.Cli"
      ]
    }
  },
  "ExpectedVersionMapAsInclude": true,
  "ExpectedVersionMapUseWildcards": false,
  "Configuration": "Release",
  "StagingPath": "Artefacts/ProjectBuild",
  "CleanStaging": true,
  "PlanOutputPath": "Artefacts/ProjectBuild/project.build.plan.json",
  "UpdateVersions": true,
  "Build": true,
  "PublishNuget": false,
  "PublishGitHub": false,
  "CreateReleaseZip": true,
  "CertificateThumbprint": "92E95FB58EFFA6A4A75E77A33CDD6BFE6DD30F1A",
  "CertificateStore": "CurrentUser",
  "TimeStampServer": "http://timestamp.digicert.com",
  "PublishSource": "https://api.nuget.org/v3/index.json",
  "PublishApiKeyFilePath": "C:\\Support\\Important\\NugetOrgEvotec.txt",
  "SkipDuplicate": true,
  "PublishFailFast": true,
  "GitHubAccessTokenFilePath": "C:\\Support\\Important\\GithubAPI.txt",
  "GitHubUsername": "EvotecIT",
  "GitHubRepositoryName": "PSPublishModule",
  "GitHubIsPreRelease": false,
  "GitHubIncludeProjectNameInTag": false,
  "GitHubGenerateReleaseNotes": true,
  "GitHubReleaseMode": "Single",
  "GitHubPrimaryProject": "PowerForge.Cli",
  "GitHubTagTemplate": "{Repo}-v{PrimaryVersion}",
  "GitHubReleaseName": "{Repo} {PrimaryVersion}"
}
